title,category,link
A decade of good website design,technology,article-jul-1745.html
Agassi fear for Melbourne,sport,article-jul-0465.html
Ailing EuroDisney vows turnaround,business,article-jul-4512.html
Ajax refuse to rule out Jol move,sport,article-jul-2758.html
Anelka apologises for criticism,sport,article-jul-4068.html
Apple attacked over sources row,technology,article-jul-1257.html
Apple iPod family expands market,technology,article-jul-2965.html
Argonaut founder rebuilds empire,technology,article-jul-2977.html
Arsenal 1-1 Sheff Utd,sport,article-jul-0794.html
Asia shares defy post-quake gloom,business,article-jul-0495.html
Aviation firms eye booming India,business,article-jul-2215.html
BT program to beat dialler scams,technology,article-jul-4187.html
Bat spit drug firm goes to market,business,article-jul-3607.html
Bees handed potential Man Utd tie,sport,article-jul-3406.html
Blackburn v Burnley,sport,article-jul-4480.html
Boeing unveils new 777 aircraft,business,article-jul-4575.html
Breaking news: US company admits Benin bribery,sport,article-jul-2829.html
Broadband in the UK growing fast,technology,article-jul-4356.html
Bryan twins keep US hopes alive,sport,article-jul-3487.html
Building giant in asbestos payout,business,article-jul-3941.html
California sets fines for spyware,technology,article-jul-4527.html
Call to overhaul UK state pension,business,article-jul-3516.html
Campbell to be Lions consultant,sport,article-jul-0165.html
Cantona issues Man Utd job hint,sport,article-jul-2340.html
Chinese exports rise 25% in 2004,business,article-jul-4614.html
Clijsters could play Aussie Open,sport,article-jul-2009.html
Corry backs skipper Robinson,sport,article-jul-2742.html
DVD copy protection strengthened,technology,article-jul-3010.html
Dallaglio his own man to the end,sport,article-jul-4101.html
Dawson wins England squad recall,sport,article-jul-2708.html
Dementieva prevails in Hong Kong,sport,article-jul-4268.html
Disney backs Sony DVD technology,technology,article-jul-4019.html
Dominici backs lacklustre France,sport,article-jul-1748.html
Dublin hi-tech labs to shut down,technology,article-jul-1249.html
Ebbers denies WorldCom fraud,business,article-jul-4170.html
England coach faces rap after row,sport,article-jul-2162.html
European losses hit GM's profits,business,article-jul-0339.html
Fifa agrees goal-line technology,sport,article-jul-2286.html
Freeze on anti-spam campaign,technology,article-jul-2988.html
French boss to leave EADS,business,article-jul-4021.html
German economy rebounds,business,article-jul-4373.html
Glazer makes new Man Utd approach,business,article-jul-4895.html
Google to scan famous libraries,technology,article-jul-4326.html
Greek sprinters 'won't run again',sport,article-jul-0662.html
Greek sprinters suspended by IAAF,sport,article-jul-2558.html
Gunners clock up winning record,sport,article-jul-3455.html
Halo 2 heralds traffic explosion,technology,article-jul-4969.html
Henson stakes early Lions claim,sport,article-jul-3422.html
Hewitt fights back to reach final,sport,article-jul-1711.html
Holmes is hit by hamstring injury,sport,article-jul-2063.html
IBM frees 500 software patents,technology,article-jul-2960.html
India's Reliance family feud heats up,business,article-jul-4915.html
India's rupee hits five-year high,business,article-jul-4812.html
Ink helps drive democracy in Asia,technology,article-jul-3520.html
Irish finish with home game,sport,article-jul-0643.html
J&J agrees $25bn Guidant deal,business,article-jul-3273.html
Johansson takes Adelaide victory,sport,article-jul-3870.html
Jones doping probe begins,sport,article-jul-0803.html
Kenteris denies faking road crash,sport,article-jul-4157.html
Khodorkovsky quits Yukos shares,business,article-jul-0297.html
Latest Opera browser gets vocal,technology,article-jul-4908.html
Legendary Dutch boss Michels dies,sport,article-jul-1013.html
Lions blow to World Cup stars,sport,article-jul-4496.html
Liverpool revel in night of glory,sport,article-jul-3168.html
Man Utd to open books to Glazer,business,article-jul-4242.html
Man Utd urged to seal Giggs deal,sport,article-jul-2527.html
Melzer shocks Agassi in San Jose,sport,article-jul-1760.html
Microsoft debuts security tools,technology,article-jul-4400.html
Millions buy MP3 players in US,technology,article-jul-4827.html
Mobile multimedia slow to catch on,technology,article-jul-4341.html
Mobiles get set for visual radio,technology,article-jul-3525.html
Mobiles rack up 20 years of use,technology,article-jul-2544.html
Molby says Gravesen is Real deal,sport,article-jul-0637.html
More power to the people says HP,technology,article-jul-4798.html
Musicians 'upbeat' about the net,technology,article-jul-2909.html
News Corp eyes video games market,business,article-jul-2815.html
No half measures with Half-Life 2,technology,article-jul-4628.html
Parmar ruled out of Davis Cup tie,sport,article-jul-1361.html
Philippoussis doubt over Open bid,sport,article-jul-0597.html
Pompeii gets digital make-over,technology,article-jul-2241.html
Q&A: Malcolm Glazer and Man Utd,business,article-jul-1728.html
Radcliffe eyes hard line on drugs,sport,article-jul-1219.html
Real will finish abandoned match,sport,article-jul-4829.html
Ref stands by Scotland decisions,sport,article-jul-1320.html
Robinson wants dual code success,sport,article-jul-2463.html
Roche 'turns down Federer offer',sport,article-jul-3438.html
Roddick splits from coach Gilbert,sport,article-jul-4719.html
Ronaldinho denies Blues interest,sport,article-jul-3289.html
S Korea spending boost to economy,business,article-jul-2439.html
S Korean consumers spending again,business,article-jul-3943.html
Saudi investor picks up the Savoy,business,article-jul-3331.html
Sella wants Michalak recall,sport,article-jul-3957.html
Share boost for feud-hit Reliance,business,article-jul-0733.html
Shares rise on new Man Utd offer,business,article-jul-0168.html
Sony PSP tipped as a 'must-have',technology,article-jul-2667.html
Souness eyes summer move for Owen,sport,article-jul-4244.html
Souped-up wi-fi is on the horizon,technology,article-jul-0334.html
South African car demand surges,business,article-jul-0645.html
Stam spices up Man Utd encounter,sport,article-jul-3380.html
Tapping-up row is so much hot air,sport,article-jul-0019.html
Technology gets the creative bug,technology,article-jul-4790.html
Technology in rugby: GPS systems continue to grow in importance,technology,article-jul-4384.html
Tindall aiming to earn Lions spot,sport,article-jul-3522.html
Tindall wants second opinion,sport,article-jul-1717.html
Tsunami 'to hit Sri Lanka banks',business,article-jul-1112.html
UK economy facing 'major risks',business,article-jul-0202.html
US Ahold suppliers face charges,business,article-jul-1885.html
US data sparks inflation worries,business,article-jul-3830.html
US interest rate rise expected,business,article-jul-0931.html
US peer-to-peer pirates convicted,technology,article-jul-1059.html
"Umaga ready for ""fearsome"" Lions",sport,article-jul-3879.html
Virus poses as Christmas e-mail,technology,article-jul-4233.html
Wal-Mart fights back at accusers,business,article-jul-0417.html
Wales coach elated with win,sport,article-jul-3332.html
Warning over US pensions deficit,business,article-jul-0589.html
Web photo storage market hots up,technology,article-jul-4193.html
Web radio takes Spanish rap global,technology,article-jul-0503.html
Wenger keeping faith with Almunia,sport,article-jul-1350.html
Wenger steps up row,sport,article-jul-1729.html
What now for British tennis?,sport,article-jul-4500.html
White admits to Balco drugs link,sport,article-jul-3874.html
World tour for top video gamers,technology,article-jul-2168.html
